{
  "schema_version": "1.0",
  "as_of": "2026-09-04T18:00:00+08:00",
  "currency": "CNY",
  "account_scope": "STRATEGY_MANAGED",
  "scope_completeness": "COMPLETE",
  "positions_completeness": "UNKNOWN",
  "available_cash": 100000,
  "managed_total_assets": 1000000,
  "excluded_asset_value": 0,
  "source_note": "离线示例: 持仓事实未知",
  "positions": []
}
